"Story","Title","Result","Date","Stability","Duration (s)"
"Review AP entries","Edit voucher entries delete a line","ERROR","2024-06-06T09:52:40.681+08:00[Asia/Shanghai]","0.0","216.35"
"Review AP entries","Create manual payment and delete unposted payment","ERROR","2024-06-06T09:56:17.738+08:00[Asia/Shanghai]","0.0","240.83"
"Review AP entries","Clear employee field for GL distribution and voucher entries","ERROR","2024-06-06T10:00:19.293+08:00[Asia/Shanghai]","0.0","132.24"
"Review AP entries","Create voucher entry and edit","ERROR","2024-06-06T10:04:25.687+08:00[Asia/Shanghai]","0.0","142.14"
"Review AP entries","Edit AP entries","ERROR","2024-06-06T10:06:48.532+08:00[Asia/Shanghai]","0.0","145.36"
"Review AP entries","Reversal of unposted voucher match","ERROR","2024-06-06T10:12:03.207+08:00[Asia/Shanghai]","0.0","107.25"
"Review AP entries","Check edit button for voucher entry and redistribute GL","FAILURE","2024-06-06T10:13:51.196+08:00[Asia/Shanghai]","0.0","117.16"
"Review AP entries","Edit voucher entry line account number","ERROR","2024-06-06T10:16:53.349+08:00[Asia/Shanghai]","0.0","207.11"
"Review AP entries","Create voucher entry review and delete","ERROR","2024-06-06T10:27:25.216+08:00[Asia/Shanghai]","0.0","143.8"
