"Story","Title","Result","Date","Stability","Duration (s)"
"Manage bank account","Add a bank account","FAILURE","2024-08-22T11:55:31.311+08:00[Asia/Shanghai]","0.0","39.74"
"Manage bank account","Edit a bank account","FAILURE","2024-08-22T11:56:12.059+08:00[Asia/Shanghai]","0.0","52.06"
"Manage bank account","Search a bank account","FAILURE","2024-08-22T11:57:04.963+08:00[Asia/Shanghai]","0.0","42.59"
"Manage bank account","Activate a bank account","FAILURE","2024-08-22T11:57:48.458+08:00[Asia/Shanghai]","0.0","51.43"
"Manage bank account","Manage bank account using GVAGL bank account","FAILURE","2024-08-22T11:58:40.658+08:00[Asia/Shanghai]","0.0","43.27"
