"Story","Title","Result","Date","Stability","Duration (s)"
"Account recon","Refresh accounts","SUCCESS","2024-06-05T19:40:13.219+08:00[Asia/Shanghai]","0.0","51.73"
"Annual statistical budget","Create annual statistical entry","SUCCESS","2024-06-05T19:41:05.791+08:00[Asia/Shanghai]","0.0","48.64"
"Batch posting","Batch posting voiding process","SUCCESS","2024-06-05T19:41:55.225+08:00[Asia/Shanghai]","0.0","127.17"
"Batch posting","Batch posting general ledger entry","SUCCESS","2024-06-05T19:44:03.107+08:00[Asia/Shanghai]","0.0","107.65"
"General ledger entries","Create general ledger entry","SUCCESS","2024-06-05T19:48:49.876+08:00[Asia/Shanghai]","0.0","111.39"
"Internal transfer","Create internal transfer entry","SUCCESS","2024-06-05T19:51:19.578+08:00[Asia/Shanghai]","0.0","78.46"
"Monthly statistical entries","Create monthly statistical entry","SUCCESS","2024-06-05T19:52:38.847+08:00[Asia/Shanghai]","0.0","44.47"
"Salary advance","Create salary advance entry","SUCCESS","2024-06-05T19:53:24.118+08:00[Asia/Shanghai]","0.0","91.4"
"Working advance","Create working advance entry","SUCCESS","2024-06-05T19:54:56.345+08:00[Asia/Shanghai]","0.0","84.49"
