"Story","Title","Result","Date","Stability","Duration (s)"
"Account recon","Refresh accounts","SUCCESS","2024-09-06T18:17:28.138+08:00[Asia/Shanghai]","0.0","49.89"
"Batch posting","Batch posting voiding process","SUCCESS","2024-09-06T18:18:21.917+08:00[Asia/Shanghai]","0.0","156.48"
"Batch posting","Batch posting general ledger entry","SUCCESS","2024-09-06T18:20:59.4+08:00[Asia/Shanghai]","0.0","176.74"
"General ledger entries","Create general ledger entry","SUCCESS","2024-09-06T18:27:26.001+08:00[Asia/Shanghai]","0.0","120.14"
"Salary advance","Create salary advance entry","SUCCESS","2024-09-06T18:36:00.472+08:00[Asia/Shanghai]","0.0","111.6"
"Working advance","Create working advance entry","SUCCESS","2024-09-06T18:37:53.218+08:00[Asia/Shanghai]","0.0","107.81"
