"Story","Title","Result","Date","Stability","Duration (s)"
"Annual statistical budget","Create annual statistical entry","ERROR","2024-09-06T18:18:19.195+08:00[Asia/Shanghai]","0.0","2.62"
"General ledger entries","Create general ledger entry using sustainability accounts","ERROR","2024-09-06T18:23:57.628+08:00[Asia/Shanghai]","0.0","207.42"
"Inquiry and reports","Order inquiry and update","FAILURE","2024-09-06T18:29:27.501+08:00[Asia/Shanghai]","0.0","47.91"
"Internal transfer","Create internal transfer entry","ERROR","2024-09-06T18:30:16.58+08:00[Asia/Shanghai]","0.0","178.86"
"Monthly statistical entries","Create monthly statistical entry","ERROR","2024-09-06T18:33:16.514+08:00[Asia/Shanghai]","0.0","162.89"
