"Story","Title","Result","Date","Stability","Duration (s)"
"Review AP entries","Edit voucher entries delete a line","ERROR","2024-09-02T18:29:10.369+08:00[Asia/Shanghai]","0.0","220.37"
"Review AP entries","Create manual payment and delete unposted payment","ERROR","2024-09-02T18:32:51.722+08:00[Asia/Shanghai]","0.0","194.62"
"Review AP entries","Clear employee field for GL distribution and voucher entries","ERROR","2024-09-02T18:36:07.317+08:00[Asia/Shanghai]","0.0","172.94"
"Review AP entries","Create voucher entry and edit","ERROR","2024-09-02T18:41:12.596+08:00[Asia/Shanghai]","0.0","152.15"
"Review AP entries","Edit AP entries","ERROR","2024-09-02T18:43:45.729+08:00[Asia/Shanghai]","0.0","146.84"
"Review AP entries","Reversal of unposted voucher match","ERROR","2024-09-02T18:49:10.192+08:00[Asia/Shanghai]","0.0","110.44"
"Review AP entries","Edit voucher entry line account number","ERROR","2024-09-02T18:54:52.26+08:00[Asia/Shanghai]","0.0","201.48"
"Review AP entries","Payment information","ERROR","2024-09-02T18:58:14.715+08:00[Asia/Shanghai]","0.0","86.14"
"Review AP entries","Create voucher entry review and delete","ERROR","2024-09-02T19:05:53.702+08:00[Asia/Shanghai]","0.0","169.83"
