"Story","Title","Result","Date","Stability","Duration (s)"
"Account recon","Refresh accounts","SUCCESS","2023-05-30T14:48:53.872+08:00[Asia/Shanghai]","0.0","85.25"
"Annual statistical budget","Create annual statistical entry","SUCCESS","2023-05-30T14:50:19.966+08:00[Asia/Shanghai]","0.0","49.76"
"Batch posting","Batch posting voiding process","SUCCESS","2023-05-30T14:51:10.562+08:00[Asia/Shanghai]","0.0","128.07"
"Batch posting","Batch posting general ledger entry","SUCCESS","2023-05-30T14:53:19.286+08:00[Asia/Shanghai]","0.0","112.5"
"General ledger entries","Create general ledger entry","SUCCESS","2023-05-30T14:56:26.428+08:00[Asia/Shanghai]","0.0","107.26"
"Internal transfer","Create internal transfer entry","SUCCESS","2023-05-30T15:01:04.046+08:00[Asia/Shanghai]","0.0","80.76"
"Monthly statistical entries","Create monthly statistical entry","SUCCESS","2023-05-30T15:02:25.638+08:00[Asia/Shanghai]","0.0","50.76"
"Salary advance","Create salary advance entry","SUCCESS","2023-05-30T15:03:17.232+08:00[Asia/Shanghai]","0.0","85.23"
"Working advance","Create working advance entry","SUCCESS","2023-05-30T15:04:43.328+08:00[Asia/Shanghai]","0.0","84.55"
