"Story","Title","Result","Date","Stability","Duration (s)"
"Payments","Manual payment partial","ERROR","2024-11-06T08:09:29.254+08:00[Asia/Shanghai]","0.0","258.19"
"Payments","Manual payment with multiple documents","ERROR","2024-11-06T08:13:48.392+08:00[Asia/Shanghai]","0.0","277.68"
"Payments","Application of prepayment full","ERROR","2024-11-06T08:18:27.038+08:00[Asia/Shanghai]","0.0","141.83"
"Payments","Manual payment with negative amount","ERROR","2024-11-06T08:20:49.853+08:00[Asia/Shanghai]","0.0","251.45"
"Payments","Manual payment with zero payments","ERROR","2024-11-06T08:25:02.216+08:00[Asia/Shanghai]","0.0","275.32"
"Payments","Manual payment full","ERROR","2024-11-06T08:29:38.468+08:00[Asia/Shanghai]","0.0","265.15"
"Payments","Application of prepayment partial","ERROR","2024-11-06T08:34:04.49+08:00[Asia/Shanghai]","0.0","145.2"
