"Story","Title","Result","Date","Stability","Duration (s)"
"Review AP entries","Edit voucher entries delete a line","ERROR","2024-04-01T22:07:20.254+08:00[Asia/Shanghai]","0.0","213.13"
"Review AP entries","Create manual payment and delete unposted payment","ERROR","2024-04-01T22:10:54.094+08:00[Asia/Shanghai]","0.0","249.63"
"Review AP entries","Clear employee field for GL distribution and voucher entries","ERROR","2024-04-01T22:15:04.485+08:00[Asia/Shanghai]","0.0","145.92"
"Review AP entries","Create voucher entry and edit","ERROR","2024-04-01T22:19:27.117+08:00[Asia/Shanghai]","0.0","140.55"
"Review AP entries","Edit AP entries","ERROR","2024-04-01T22:21:48.362+08:00[Asia/Shanghai]","0.0","141.93"
"Review AP entries","Reversal of unposted voucher match","ERROR","2024-04-01T22:27:06.36+08:00[Asia/Shanghai]","0.0","101.5"
"Review AP entries","Check edit button for voucher entry and redistribute GL","FAILURE","2024-04-01T22:28:48.58+08:00[Asia/Shanghai]","0.0","119.63"
"Review AP entries","Edit voucher entry line account number","ERROR","2024-04-01T22:31:57.259+08:00[Asia/Shanghai]","0.0","200.18"
"Review AP entries","Create voucher entry review and delete","ERROR","2024-04-01T22:42:18.385+08:00[Asia/Shanghai]","0.0","146.63"
