"Story","Title","Result","Date","Stability","Duration (s)"
"Account recon","Refresh accounts","SUCCESS","2024-03-27T18:02:30.782+08:00[Asia/Shanghai]","0.0","53.54"
"Annual statistical budget","Create annual statistical entry","SUCCESS","2024-03-27T18:03:25.546+08:00[Asia/Shanghai]","0.0","41.9"
"Batch posting","Batch posting voiding process","SUCCESS","2024-03-27T18:04:08.367+08:00[Asia/Shanghai]","0.0","129.89"
"Batch posting","Batch posting general ledger entry","SUCCESS","2024-03-27T18:06:19.063+08:00[Asia/Shanghai]","0.0","111.55"
"General ledger entries","Create general ledger entry","SUCCESS","2024-03-27T18:11:15.404+08:00[Asia/Shanghai]","0.0","109.57"
"Internal transfer","Create internal transfer entry","SUCCESS","2024-03-27T18:13:45.598+08:00[Asia/Shanghai]","0.0","81.29"
"Monthly statistical entries","Create monthly statistical entry","SUCCESS","2024-03-27T18:15:07.977+08:00[Asia/Shanghai]","0.0","39.92"
"Salary advance","Create salary advance entry","SUCCESS","2024-03-27T18:15:49.334+08:00[Asia/Shanghai]","0.0","75.68"
"Working advance","Create working advance entry","SUCCESS","2024-03-27T18:17:05.93+08:00[Asia/Shanghai]","0.0","80.25"
