"Story","Title","Result","Date","Stability","Duration (s)"
"Account recon","Refresh accounts","SUCCESS","2023-06-13T15:41:04.471+08:00[Asia/Shanghai]","0.0","55.52"
"Annual statistical budget","Create annual statistical entry","SUCCESS","2023-06-13T15:42:00.805+08:00[Asia/Shanghai]","0.0","56.79"
"Batch posting","Batch posting voiding process","SUCCESS","2023-06-13T15:42:58.408+08:00[Asia/Shanghai]","0.0","126.54"
"Batch posting","Batch posting general ledger entry","SUCCESS","2023-06-13T15:45:05.632+08:00[Asia/Shanghai]","0.0","112.18"
"General ledger entries","Create general ledger entry","SUCCESS","2023-06-13T15:48:14.665+08:00[Asia/Shanghai]","0.0","107.48"
"Internal transfer","Create internal transfer entry","SUCCESS","2023-06-13T15:52:49.511+08:00[Asia/Shanghai]","0.0","79.42"
"Monthly statistical entries","Create monthly statistical entry","SUCCESS","2023-06-13T15:54:09.787+08:00[Asia/Shanghai]","0.0","59.46"
"Salary advance","Create salary advance entry","SUCCESS","2023-06-13T15:55:10.094+08:00[Asia/Shanghai]","0.0","92.34"
"Working advance","Create working advance entry","SUCCESS","2023-06-13T15:56:43.295+08:00[Asia/Shanghai]","0.0","88.4"
