"Story","Title","Result","Date","Stability","Duration (s)"
"Account recon","Refresh accounts","SUCCESS","2023-05-27T23:16:21.814+08:00[Asia/Shanghai]","0.0","93.31"
"Batch posting","Batch posting voiding process","SUCCESS","2023-05-27T23:18:26.611+08:00[Asia/Shanghai]","0.0","123.93"
"Batch posting","Batch posting general ledger entry","SUCCESS","2023-05-27T23:20:31.227+08:00[Asia/Shanghai]","0.0","127.17"
"General ledger entries","Create general ledger entry","SUCCESS","2023-05-27T23:24:05.951+08:00[Asia/Shanghai]","0.0","172.37"
"Internal transfer","Create internal transfer entry","SUCCESS","2023-05-27T23:27:09.515+08:00[Asia/Shanghai]","0.0","113.55"
"Working advance","Create working advance entry","SUCCESS","2023-05-27T23:31:03.749+08:00[Asia/Shanghai]","0.0","95.45"
