"Story","Title","Result","Date","Stability","Duration (s)"
"Review AP entries","Edit voucher entries delete a line","ERROR","2024-05-29T13:19:50.777+08:00[Asia/Shanghai]","0.0","208.02"
"Review AP entries","Create manual payment and delete unposted payment","ERROR","2024-05-29T13:23:19.509+08:00[Asia/Shanghai]","0.0","238.16"
"Review AP entries","Clear employee field for GL distribution and voucher entries","ERROR","2024-05-29T13:27:18.371+08:00[Asia/Shanghai]","0.0","139.15"
"Review AP entries","Create voucher entry and edit","ERROR","2024-05-29T13:31:35.666+08:00[Asia/Shanghai]","0.0","140.92"
"Review AP entries","Edit AP entries","ERROR","2024-05-29T13:33:57.298+08:00[Asia/Shanghai]","0.0","137.47"
"Review AP entries","Reversal of unposted voucher match","ERROR","2024-05-29T13:39:17.825+08:00[Asia/Shanghai]","0.0","101.41"
"Review AP entries","Check edit button for voucher entry and redistribute GL","FAILURE","2024-05-29T13:40:59.939+08:00[Asia/Shanghai]","0.0","122.59"
"Review AP entries","Edit voucher entry line account number","ERROR","2024-05-29T13:44:10.653+08:00[Asia/Shanghai]","0.0","206.09"
"Review AP entries","Create voucher entry review and delete","ERROR","2024-05-29T13:54:47.47+08:00[Asia/Shanghai]","0.0","141.82"
