"Story","Title","Result","Date","Stability","Duration (s)"
"Payments","Manual payment with multiple documents","ERROR","2024-06-18T14:29:13.848+08:00[Asia/Shanghai]","0.0","245.24"
"Payments","Application of prepayment full","ERROR","2024-06-18T14:33:19.811+08:00[Asia/Shanghai]","0.0","93.54"
"Payments","Manual payment with negative amount","ERROR","2024-06-18T14:34:54.068+08:00[Asia/Shanghai]","0.0","228.8"
"Payments","Manual payment with zero payments","FAILURE","2024-06-18T14:38:43.63+08:00[Asia/Shanghai]","0.0","377.94"
"Payments","Application of prepayment partial","ERROR","2024-06-18T14:48:43.084+08:00[Asia/Shanghai]","0.0","82.78"
