"Story","Title","Result","Date","Stability","Duration (s)"
"Manage bank account","Add a bank account","FAILURE","2024-06-18T14:22:22.577+08:00[Asia/Shanghai]","0.0","38.39"
"Manage bank account","Edit a bank account","FAILURE","2024-06-18T14:23:01.907+08:00[Asia/Shanghai]","0.0","39.53"
"Manage bank account","Search a bank account","FAILURE","2024-06-18T14:23:42.193+08:00[Asia/Shanghai]","0.0","41.54"
"Manage bank account","Activate a bank account","FAILURE","2024-06-18T14:24:24.732+08:00[Asia/Shanghai]","0.0","43.54"
"Manage bank account","Manage bank account using GVAGL bank account","FAILURE","2024-06-18T14:25:09.051+08:00[Asia/Shanghai]","0.0","43.19"
