"Story","Title","Result","Date","Stability","Duration (s)"
"Account recon","Refresh accounts","SUCCESS","2023-06-02T15:20:47.89+08:00[Asia/Shanghai]","0.0","80.56"
"Annual statistical budget","Create annual statistical entry","SUCCESS","2023-06-02T15:22:09.268+08:00[Asia/Shanghai]","0.0","47.62"
"Batch posting","Batch posting voiding process","SUCCESS","2023-06-02T15:22:57.73+08:00[Asia/Shanghai]","0.0","126.0"
"Batch posting","Batch posting general ledger entry","SUCCESS","2023-06-02T15:25:04.379+08:00[Asia/Shanghai]","0.0","112.19"
"General ledger entries","Create general ledger entry","SUCCESS","2023-06-02T15:28:08.163+08:00[Asia/Shanghai]","0.0","114.03"
"Internal transfer","Create internal transfer entry","SUCCESS","2023-06-02T15:32:51.208+08:00[Asia/Shanghai]","0.0","79.48"
"Monthly statistical entries","Create monthly statistical entry","SUCCESS","2023-06-02T15:34:11.511+08:00[Asia/Shanghai]","0.0","47.1"
"Salary advance","Create salary advance entry","SUCCESS","2023-06-02T15:34:59.436+08:00[Asia/Shanghai]","0.0","86.51"
"Working advance","Create working advance entry","SUCCESS","2023-06-02T15:36:26.775+08:00[Asia/Shanghai]","0.0","84.32"
