"Story","Title","Result","Date","Stability","Duration (s)"
"Payments","Manual payment with multiple documents","ERROR","2024-05-30T11:33:44.396+08:00[Asia/Shanghai]","0.0","247.64"
"Payments","Application of prepayment full","ERROR","2024-05-30T11:37:52.752+08:00[Asia/Shanghai]","0.0","97.86"
"Payments","Manual payment with negative amount","ERROR","2024-05-30T11:39:31.305+08:00[Asia/Shanghai]","0.0","226.27"
"Payments","Manual payment with zero payments","ERROR","2024-05-30T11:43:18.358+08:00[Asia/Shanghai]","0.0","391.51"
"Payments","Application of prepayment partial","ERROR","2024-05-30T11:53:17.416+08:00[Asia/Shanghai]","0.0","68.82"
