"Story","Title","Result","Date","Stability","Duration (s)"
"Review AP entries","Reversal of unposted PO redistribution","SUCCESS","2024-08-20T17:29:48.561+08:00[Asia/Shanghai]","0.0","130.25"
"Review AP entries","Review voucher AP entries","SUCCESS","2024-08-20T17:36:41.411+08:00[Asia/Shanghai]","0.0","129.55"
"Review AP entries","Search payment","SUCCESS","2024-08-20T17:38:51.767+08:00[Asia/Shanghai]","0.0","34.69"
"Review AP entries","Delete voucher AP entry","SUCCESS","2024-08-20T17:49:13.266+08:00[Asia/Shanghai]","0.0","135.99"
"Review AP entries","Create voucher entry and test filter selection","SUCCESS","2024-08-20T17:51:30.056+08:00[Asia/Shanghai]","0.0","196.18"
