"Story","Title","Result","Date","Stability","Duration (s)"
"Payments","Manual payment partial","ERROR","2024-11-08T08:30:35.034+08:00[Asia/Shanghai]","0.0","169.55"
"Payments","Manual payment with multiple documents","ERROR","2024-11-08T08:33:25.515+08:00[Asia/Shanghai]","0.0","33.31"
"Payments","Application of prepayment full","ERROR","2024-11-08T08:33:59.805+08:00[Asia/Shanghai]","0.0","173.0"
"Payments","Manual payment with negative amount","ERROR","2024-11-08T08:36:53.774+08:00[Asia/Shanghai]","0.0","154.36"
"Payments","Manual payment with zero payments","ERROR","2024-11-08T08:39:29.112+08:00[Asia/Shanghai]","0.0","164.08"
"Payments","Manual payment full","ERROR","2024-11-08T08:42:14.218+08:00[Asia/Shanghai]","0.0","190.08"
"Payments","Application of prepayment partial","ERROR","2024-11-08T08:45:25.279+08:00[Asia/Shanghai]","0.0","192.58"
"Pre registration","Pre logging multi docs","ERROR","2024-11-08T08:52:09.13+08:00[Asia/Shanghai]","0.0","186.81"
"Pre registration","Pre logging simple","ERROR","2024-11-08T08:58:42.441+08:00[Asia/Shanghai]","0.0","189.31"
"Pre registration","Pre logging with tax rate","ERROR","2024-11-08T09:01:52.653+08:00[Asia/Shanghai]","0.0","182.03"
"Redistribution","Pre logging GL distribution current year","ERROR","2024-11-08T09:04:56.796+08:00[Asia/Shanghai]","0.0","65.48"
"Redistribution","Voucher match with tolerance","ERROR","2024-11-08T09:08:21.214+08:00[Asia/Shanghai]","0.0","188.7"
"Review AP entries","Edit voucher entries delete a line","ERROR","2024-11-08T09:11:31.424+08:00[Asia/Shanghai]","0.0","52.23"
"Review AP entries","Create manual payment and delete unposted payment","ERROR","2024-11-08T09:12:24.623+08:00[Asia/Shanghai]","0.0","234.3"
"Review AP entries","Clear employee field for GL distribution and voucher entries","ERROR","2024-11-08T09:16:19.866+08:00[Asia/Shanghai]","0.0","209.77"
"Review AP entries","Create voucher entry and edit","ERROR","2024-11-08T09:22:53.218+08:00[Asia/Shanghai]","0.0","196.17"
"Review AP entries","Edit AP entries","ERROR","2024-11-08T09:26:10.382+08:00[Asia/Shanghai]","0.0","174.03"
"Review AP entries","Reversal of unposted voucher match","ERROR","2024-11-08T09:33:33.1+08:00[Asia/Shanghai]","0.0","125.57"
"Review AP entries","Check edit button for voucher entry and redistribute GL","ERROR","2024-11-08T09:35:39.673+08:00[Asia/Shanghai]","0.0","122.75"
"Review AP entries","Edit voucher entry line account number","ERROR","2024-11-08T09:39:36.595+08:00[Asia/Shanghai]","0.0","43.46"
"Review AP entries","Payment information","ERROR","2024-11-08T09:40:21.052+08:00[Asia/Shanghai]","0.0","89.74"
"Review AP entries","Create voucher entry and test filter selection","ERROR","2024-11-08T09:44:57.368+08:00[Asia/Shanghai]","0.0","74.51"
"Review AP entries","Create voucher entry review and delete","ERROR","2024-11-08T09:46:12.843+08:00[Asia/Shanghai]","0.0","181.21"
"Voucher entries","Voucher match with positive for adding a line","ERROR","2024-11-08T10:10:34.545+08:00[Asia/Shanghai]","0.0","58.11"
"Voucher entries","Checking line reference place holder","ERROR","2024-11-08T10:15:20.375+08:00[Asia/Shanghai]","0.0","153.46"
"Voucher entries","Search and post PV","ERROR","2024-11-08T10:17:54.877+08:00[Asia/Shanghai]","0.0","68.06"
"Voucher entries","Voucher entry delete a line","ERROR","2024-11-08T10:19:03.899+08:00[Asia/Shanghai]","0.0","50.61"
"Voucher entries","Voucher match with tax","ERROR","2024-11-08T10:19:55.496+08:00[Asia/Shanghai]","0.0","58.38"
"Voucher entries","Partial voucher match","ERROR","2024-11-08T10:20:54.828+08:00[Asia/Shanghai]","0.0","110.6"
"Voucher entries","Voucher match with retention","ERROR","2024-11-08T10:22:46.443+08:00[Asia/Shanghai]","0.0","93.42"
"Voucher entries","Voucher entry import CSV file","ERROR","2024-11-08T10:24:20.817+08:00[Asia/Shanghai]","0.0","151.06"
"Voucher entries","Voucher match with negative for adding a line","ERROR","2024-11-08T10:26:52.818+08:00[Asia/Shanghai]","0.0","82.25"
"Voucher entries","Partial voucher match with tax rate","ERROR","2024-11-08T10:28:16.104+08:00[Asia/Shanghai]","0.0","60.8"
"Voucher entries","Partial voucher match with negative additional lines","ERROR","2024-11-08T10:34:51.753+08:00[Asia/Shanghai]","0.0","63.62"
"Voucher entries","Voucher entry proceed to payment","ERROR","2024-11-08T10:36:53.371+08:00[Asia/Shanghai]","0.0","201.83"
"Voucher entries","Multiple lines with same PO and different item code","ERROR","2024-11-08T10:40:16.132+08:00[Asia/Shanghai]","0.0","58.61"
"Voucher entries","Partial voucher match with retention","ERROR","2024-11-08T10:41:15.672+08:00[Asia/Shanghai]","0.0","86.91"
"Voucher entries","Multiple lines with different PO and different item code","ERROR","2024-11-08T10:42:43.675+08:00[Asia/Shanghai]","0.0","79.12"
"Voucher entries","Create voucher entry using sustainability accounts","ERROR","2024-11-08T10:44:03.761+08:00[Asia/Shanghai]","0.0","224.43"
"Voucher entries","Multiple lines with same PO and same item code","ERROR","2024-11-08T10:47:49.116+08:00[Asia/Shanghai]","0.0","89.11"
"Voucher entries","Voucher match with retention and tax","ERROR","2024-11-08T10:49:19.177+08:00[Asia/Shanghai]","0.0","99.36"
"Voucher entries","Multiple lines with different PO and same item code","ERROR","2024-11-08T10:50:59.546+08:00[Asia/Shanghai]","0.0","63.79"
"Voucher entries","Simple voucher match","ERROR","2024-11-08T10:52:04.305+08:00[Asia/Shanghai]","0.0","60.83"
"Voucher entries","Release retention partial","ERROR","2024-11-08T10:53:06.14+08:00[Asia/Shanghai]","0.0","191.3"
"Voucher entries","Partial matching with rounded tax amount","ERROR","2024-11-08T10:56:18.359+08:00[Asia/Shanghai]","0.0","66.33"
"Voucher entries","Voucher matching","ERROR","2024-11-08T11:00:58.623+08:00[Asia/Shanghai]","0.0","73.6"
"Voucher entries","Creating voucher entry","ERROR","2024-11-08T11:05:20.69+08:00[Asia/Shanghai]","0.0","162.14"
"Voucher entries","Release retention adding a line","ERROR","2024-11-08T11:08:03.841+08:00[Asia/Shanghai]","0.0","221.72"
"Voucher entries","Voucher match with rounded off tax","ERROR","2024-11-08T11:11:46.511+08:00[Asia/Shanghai]","0.0","76.18"
"Voucher entries","Voucher entry credit memo","ERROR","2024-11-08T11:13:03.685+08:00[Asia/Shanghai]","0.0","59.2"
"Voucher entries","Partial voucher match with positive additional lines","ERROR","2024-11-08T11:14:03.884+08:00[Asia/Shanghai]","0.0","59.19"
"Account recon","Refresh accounts","ERROR","2024-11-08T11:15:08.508+08:00[Asia/Shanghai]","0.0","231.69"
"Annual statistical budget","Create annual statistical entry","ERROR","2024-11-08T11:19:01.235+08:00[Asia/Shanghai]","0.0","51.47"
"Batch posting","Batch posting voiding process","ERROR","2024-11-08T11:19:53.79+08:00[Asia/Shanghai]","0.0","216.25"
"Batch posting","Batch posting general ledger entry","ERROR","2024-11-08T11:23:31.033+08:00[Asia/Shanghai]","0.0","91.81"
"General ledger entries","Create general ledger entry using sustainability accounts","ERROR","2024-11-08T11:25:04.041+08:00[Asia/Shanghai]","0.0","189.81"
"General ledger entries","Create general ledger entry","ERROR","2024-11-08T11:28:14.834+08:00[Asia/Shanghai]","0.0","115.88"
"Monthly statistical entries","Create monthly statistical entry","ERROR","2024-11-08T11:33:08.482+08:00[Asia/Shanghai]","0.0","80.0"
"Salary advance","Create salary advance entry","ERROR","2024-11-08T11:34:29.576+08:00[Asia/Shanghai]","0.0","92.14"
"Working advance","Create working advance entry","ERROR","2024-11-08T11:36:02.751+08:00[Asia/Shanghai]","0.0","74.93"
